{
  "acquired_on": "2026-07-14",
  "artifact_sha256": "85a5752da05f53c456ca3a9e038c90358e1d5a3141d1f0d6e5f0970f2356e821",
  "audit_statement": "The file is the exact nist_ctc_01_asme1_ap242-e1.stp entry from NIST-PMI-STEP-Files.zip. Its Part 21 header declares AP242 edition 1. NIST states that the bundle files were generated by different CAD software, while intentionally removing the individual CAD-system identity; no exporter name or version is inferred from the payload.",
  "canonicalization": "sorted-pretty-json-v1",
  "export_settings": "NIST CTC-01 geometry with PMI representation and/or presentation, serialized as STEP AP242 edition 1; individual CAD application and option details were intentionally removed by NIST.",
  "exporter": {
    "name": "Undisclosed CAD system in NIST MBE PMI corpus",
    "version": "not disclosed by NIST"
  },
  "fixture_id": "external.nist.ctc_01.ap242_e1",
  "licence_identifier": "NIST-PMI-unrestricted-use",
  "owner": "National Institute of Standards and Technology (NIST)",
  "redistribution_allowed": true,
  "schema_version": "1.0.0",
  "source": "https://www.nist.gov/ctl/smart-connected-systems-division/smart-connected-manufacturing-systems-group/mbe-pmi-0",
  "step_schema": "AP242DIS"
}
